<?xml version="1.0"?>
<TranslateStatus xmlns:xsi="http://www.w3.org/2001/XMLSchema-instance"
                 xsi:noNamespaceSchemaLocation="status-translator.xsd">
    <Status>
        <originalName>ifsFilter</originalName>
        <translatedName>ifsFilter.gemini</translatedName>
        <originalType>STRING</originalType>
        <translatedType>STRING</translatedType>
        <Maps>
            <Map>
                <from>Y</from>
                <to>IFSFILT_Y_G1211</to>
            </Map>
            <Map>
                <from>J</from>
                <to>IFSFILT_J_G1212</to>
            </Map>
            <Map>
                <from>H</from>
                <to>IFSFILT_H_G1213</to>
            </Map>
            <Map>
                <from>K1</from>
                <to>IFSFILT_K1_G1214</to>
            </Map>
            <Map>
                <from>K2</from>
                <to>IFSFILT_K2_G1215</to>
            </Map>
            <Map>
                <from>UNKNOWN</from>
                <to>UNKNOWN</to>
            </Map>
        </Maps>
    </Status>
    <Status>
        <originalName>aoWfsFilter</originalName>
        <translatedName>aoWfsFilter.gemini</translatedName>
        <originalType>STRING</originalType>
        <translatedType>STRING</translatedType>
        <Maps>
            <Map>
                <from>600NM_LOW_CUTOFF</from>
                <to>AOFILT_600NM_G1221</to>
            </Map>
            <Map>
                <from>700NM_LOW_CUTOFF</from>
                <to>AOFILT_700NM_G1222</to>
            </Map>
            <Map>
                <from>800NM_LOW_CUTOFF</from>
                <to>AOFILT_800NM_G1223</to>
            </Map>
            <Map>
                <from>900NM_LOW_CUTOFF</from>
                <to>AOFILT_900NM_G1224</to>
            </Map>
            <Map>
                <from>910_900NM_BAND_PASS</from>
                <to>AOFILT_910_900NM_BAND_PASS_G1225</to>
            </Map>
            <Map>
                <from>OPEN</from>
                <to>AOFILT_OPEN_G1226</to>
            </Map>
            <Map>
                <from>UNKNOWN</from>
                <to>UNKNOWN</to>
            </Map>
        </Maps>
    </Status>
</TranslateStatus>
